{
  "project_key": "ellevio_nordsyd_simessjon",
  "project_name": "Simessjön",
  "station_name": "Simessjön",
  "subproject_grouping": "Östra Hälsingland (Bollnästriangeln)",
  "operator": "Ellevio",
  "country": "SE",
  "program": "nordsyd",
  "project_type": "greenfield",
  "voltage_levels": {
    "existing_kv": [],
    "new_kv": [130],
    "decommissioned_kv": [],
    "voltage_note": "New greenfield 130 kV substation."
  },
  "scope_description": "Greenfield 130 kV substation with double-breaker switchgear. Good site availability. Part of the Bollnästriangeln cluster (Simessjön, Prästnäset, Bolle) within a 30 km radius for attractive packaging and good build sequencing.",
  "equipment_scope": [
    {"equipment_type": "circuit_breaker", "voltage_kv": 145, "count_min": 4, "count_max": 6, "note": "Double-breaker switchgear."}
  ],
  "timeline": {
    "field_work_start_year": null,
    "field_work_start_quarter": null,
    "commission_year": 2028,
    "commission_quarter": null,
    "procurement_start_date": null,
    "procurement_end_date": null,
    "construction_start_date": null,
    "construction_end_date": null,
    "timeline_note": null
  },
  "contract": {
    "value_band_msek": "over_200",
    "estimated_value_msek": null,
    "package_id": "2",
    "currency": "SEK",
    "contract_note": "Package 2 (>200 MSEK), bundled with Brändarna, Prästnäset, and Bolle."
  },
  "dependencies": {
    "svenska_kraftnat_dependency": true,
    "customer_agreement": null,
    "related_program": "NordSyd",
    "production_transfer_note": null
  },
  "lifecycle_phase": "permit_pending",
  "raw_status": "Pågående prekval",
  "narrative_note": "Source explicitly notes ongoing pre-qualification (Pågående prekval) for the Bollnästriangeln package.",
  "source_doc_key": "ellevio_stationsentreprenader_mellansverige_2026q1",
  "source_page": 18,
  "extraction_method": "llm_extracted",
  "extraction_run_id": "2026-05-03-stationsentreprenader-q1-2026-v1",
  "extraction_prompt_version": "v1.0",
  "confidence_tier": "observed"
}
