{
  "project_key": "ellevio_supplementary_broby",
  "project_name": "Broby",
  "station_name": "Broby",
  "subproject_grouping": "Broby-Kvarnberg",
  "operator": "Ellevio",
  "country": "SE",
  "program": "supplementary",
  "project_type": "greenfield",
  "voltage_levels": {
    "existing_kv": [],
    "new_kv": [130, 36],
    "decommissioned_kv": [],
    "voltage_note": "New greenfield substation with 145 kV breakers, a transformer, and 36 kV switchgear."
  },
  "scope_description": "Greenfield substation Broby with 145 kV breakers, a transformer, and 36 kV switchgear. Bundled with neighboring Kvarnberg in slide 17 listing.",
  "equipment_scope": [
    {"equipment_type": "circuit_breaker", "voltage_kv": 145, "count_min": 1, "count_max": 2, "note": null},
    {"equipment_type": "transformer", "voltage_kv": null, "count_min": 1, "count_max": 1, "note": null},
    {"equipment_type": "switchgear", "voltage_kv": 36, "count_min": null, "count_max": null, "note": null}
  ],
  "timeline": {
    "field_work_start_year": null,
    "field_work_start_quarter": null,
    "commission_year": 2027,
    "commission_quarter": null,
    "procurement_start_date": null,
    "procurement_end_date": null,
    "construction_start_date": null,
    "construction_end_date": null,
    "timeline_note": null
  },
  "contract": {
    "value_band_msek": "under_100",
    "estimated_value_msek": null,
    "package_id": "separate",
    "currency": "SEK",
    "contract_note": "Standalone supplementary procurement (<100 MSEK)."
  },
  "dependencies": {
    "svenska_kraftnat_dependency": false,
    "customer_agreement": null,
    "related_program": null,
    "production_transfer_note": null
  },
  "lifecycle_phase": "permit_pending",
  "raw_status": null,
  "narrative_note": "Slide 17 lists 'Broby-Kvarnberg' as one supplementary entry; slide 21 Gantt splits them into two facilities under one package context.",
  "source_doc_key": "ellevio_stationsentreprenader_mellansverige_2026q1",
  "source_page": 21,
  "extraction_method": "llm_extracted",
  "extraction_run_id": "2026-05-03-stationsentreprenader-q1-2026-v1",
  "extraction_prompt_version": "v1.0",
  "confidence_tier": "observed"
}
