{
  "project_key": "ellevio_customer_alby",
  "project_name": "Alby",
  "station_name": "Alby",
  "subproject_grouping": null,
  "operator": "Ellevio",
  "country": "SE",
  "program": "customer_driven",
  "project_type": "greenfield",
  "voltage_levels": {
    "existing_kv": [],
    "new_kv": [130],
    "decommissioned_kv": [],
    "voltage_note": "New greenfield 130 kV substation."
  },
  "scope_description": "Customer-driven greenfield 130 kV substation Alby.",
  "equipment_scope": [
    {"equipment_type": "circuit_breaker", "voltage_kv": 145, "count_min": 6, "count_max": 12, "note": null}
  ],
  "timeline": {
    "field_work_start_year": null,
    "field_work_start_quarter": null,
    "commission_year": 2029,
    "commission_quarter": null,
    "procurement_start_date": null,
    "procurement_end_date": null,
    "construction_start_date": null,
    "construction_end_date": null,
    "timeline_note": null
  },
  "contract": {
    "value_band_msek": null,
    "estimated_value_msek": null,
    "package_id": null,
    "currency": "SEK",
    "contract_note": "Customer-driven; value band not specified on Gantt."
  },
  "dependencies": {
    "svenska_kraftnat_dependency": false,
    "customer_agreement": "Customer connection drives the project; specific customer not named in this deck.",
    "related_program": null,
    "production_transfer_note": null
  },
  "lifecycle_phase": "permit_pending",
  "raw_status": null,
  "narrative_note": null,
  "source_doc_key": "ellevio_stationsentreprenader_mellansverige_2026q1",
  "source_page": 22,
  "extraction_method": "llm_extracted",
  "extraction_run_id": "2026-05-03-stationsentreprenader-q1-2026-v1",
  "extraction_prompt_version": "v1.0",
  "confidence_tier": "observed"
}
