{
  "project_key": "ellevio_nordsyd_prastnaset",
  "project_name": "Prästnäset",
  "station_name": "Prästnäset",
  "subproject_grouping": "Östra Hälsingland (Bollnästriangeln)",
  "operator": "Ellevio",
  "country": "SE",
  "program": "nordsyd",
  "project_type": "greenfield",
  "voltage_levels": {
    "existing_kv": [],
    "new_kv": [130, 70, 10],
    "decommissioned_kv": [],
    "voltage_note": "New greenfield substation with 130 kV double-breaker switchgear, 70 kV bays, transformers, and 10 kV switchgear."
  },
  "scope_description": "Greenfield 130 kV substation with double-breaker switchgear, plus 70 kV bays, transformers, and 10 kV switchgear. Good site availability. Part of the Bollnästriangeln cluster.",
  "equipment_scope": [
    {"equipment_type": "circuit_breaker", "voltage_kv": 145, "count_min": 6, "count_max": 8, "note": "Double-breaker switchgear."},
    {"equipment_type": "circuit_breaker", "voltage_kv": 72, "count_min": 2, "count_max": 2, "note": null},
    {"equipment_type": "transformer", "voltage_kv": null, "count_min": 3, "count_max": 3, "note": "Cross-voltage; count not split per voltage class in source."},
    {"equipment_type": "switchgear", "voltage_kv": 12, "count_min": null, "count_max": null, "note": "12 kV switchgear."}
  ],
  "timeline": {
    "field_work_start_year": null,
    "field_work_start_quarter": null,
    "commission_year": 2029,
    "commission_quarter": null,
    "procurement_start_date": null,
    "procurement_end_date": null,
    "construction_start_date": null,
    "construction_end_date": null,
    "timeline_note": null
  },
  "contract": {
    "value_band_msek": "over_200",
    "estimated_value_msek": null,
    "package_id": "2",
    "currency": "SEK",
    "contract_note": "Package 2 (>200 MSEK), bundled with Simessjön, Brändarna, and Bolle."
  },
  "dependencies": {
    "svenska_kraftnat_dependency": true,
    "customer_agreement": null,
    "related_program": "NordSyd",
    "production_transfer_note": null
  },
  "lifecycle_phase": "permit_pending",
  "raw_status": "Pågående prekval",
  "narrative_note": null,
  "source_doc_key": "ellevio_stationsentreprenader_mellansverige_2026q1",
  "source_page": 18,
  "extraction_method": "llm_extracted",
  "extraction_run_id": "2026-05-03-stationsentreprenader-q1-2026-v1",
  "extraction_prompt_version": "v1.0",
  "confidence_tier": "observed"
}
