{
  "project_key": "ellevio_supplementary_brattstrommen",
  "project_name": "Brattströmmen",
  "station_name": "Brattströmmen",
  "subproject_grouping": null,
  "operator": "Ellevio",
  "country": "SE",
  "program": "supplementary",
  "project_type": "greenfield",
  "voltage_levels": {
    "existing_kv": [],
    "new_kv": [130, 70],
    "decommissioned_kv": [],
    "voltage_note": "New greenfield substation with 130 kV and 70 kV switchgear."
  },
  "scope_description": "Greenfield substation Brattströmmen with 130 kV and 70 kV switchgear and transformers.",
  "equipment_scope": [
    {"equipment_type": "circuit_breaker", "voltage_kv": 145, "count_min": 2, "count_max": 4, "note": null},
    {"equipment_type": "transformer", "voltage_kv": null, "count_min": 2, "count_max": 2, "note": "Cross-voltage; count not split per voltage class."},
    {"equipment_type": "circuit_breaker", "voltage_kv": 72, "count_min": 8, "count_max": 10, "note": null}
  ],
  "timeline": {
    "field_work_start_year": null,
    "field_work_start_quarter": null,
    "commission_year": 2028,
    "commission_quarter": null,
    "procurement_start_date": null,
    "procurement_end_date": null,
    "construction_start_date": null,
    "construction_end_date": null,
    "timeline_note": null
  },
  "contract": {
    "value_band_msek": "over_200",
    "estimated_value_msek": null,
    "package_id": "separate",
    "currency": "SEK",
    "contract_note": "Standalone supplementary procurement (>200 MSEK)."
  },
  "dependencies": {
    "svenska_kraftnat_dependency": false,
    "customer_agreement": null,
    "related_program": null,
    "production_transfer_note": null
  },
  "lifecycle_phase": "permit_pending",
  "raw_status": null,
  "narrative_note": null,
  "source_doc_key": "ellevio_stationsentreprenader_mellansverige_2026q1",
  "source_page": 21,
  "extraction_method": "llm_extracted",
  "extraction_run_id": "2026-05-03-stationsentreprenader-q1-2026-v1",
  "extraction_prompt_version": "v1.0",
  "confidence_tier": "observed"
}
