{
  "project_key": "ellevio_nordsyd_karlslund",
  "project_name": "Karlslund",
  "station_name": "Karlslund",
  "subproject_grouping": "Lindbacka-Karlslund",
  "operator": "Ellevio",
  "country": "SE",
  "program": "nordsyd",
  "project_type": "brownfield",
  "voltage_levels": {
    "existing_kv": [400, 220],
    "new_kv": [400, 130],
    "decommissioned_kv": [220],
    "voltage_note": "220 kV razed at Karlslund. New 400/130 kV transformers installed. Karlslund is rebuilt/expanded in conjunction with the new transformers."
  },
  "scope_description": "220 kV razed at Karlslund. New 400/130 kV transformers installed. Rebuild/expansion of Karlslund alongside the new transformers. Karlslund continues as 400/220 kV node per existing T1 transformer.",
  "equipment_scope": [
    {"equipment_type": "circuit_breaker", "voltage_kv": 420, "count_min": 2, "count_max": 2, "note": null},
    {"equipment_type": "circuit_breaker", "voltage_kv": 145, "count_min": 2, "count_max": 4, "note": null}
  ],
  "timeline": {
    "field_work_start_year": null,
    "field_work_start_quarter": null,
    "commission_year": 2031,
    "commission_quarter": null,
    "procurement_start_date": null,
    "procurement_end_date": null,
    "construction_start_date": null,
    "construction_end_date": null,
    "timeline_note": null
  },
  "contract": {
    "value_band_msek": "over_500",
    "estimated_value_msek": null,
    "package_id": "4",
    "currency": "SEK",
    "contract_note": "Package 4 (>500 MSEK), bundled with Lindbacka."
  },
  "dependencies": {
    "svenska_kraftnat_dependency": true,
    "customer_agreement": null,
    "related_program": "NordSyd",
    "production_transfer_note": null
  },
  "lifecycle_phase": "permit_pending",
  "raw_status": null,
  "narrative_note": "Slide 14 transformer ratings reference: T1 = 400/220 kV 750 MVA (existing at Karlslund), T6 = 400/130 kV 500 MVA (new). Located in Örebro municipality.",
  "source_doc_key": "ellevio_stationsentreprenader_mellansverige_2026q1",
  "source_page": 14,
  "extraction_method": "llm_extracted",
  "extraction_run_id": "2026-05-03-stationsentreprenader-q1-2026-v1",
  "extraction_prompt_version": "v1.0",
  "confidence_tier": "observed"
}
