{
  "project_key": "ellevio_nordsyd_branderna",
  "project_name": "Brändarna",
  "station_name": "Brändarna",
  "subproject_grouping": "Östra Hälsingland (Bollnästriangeln)",
  "operator": "Ellevio",
  "country": "SE",
  "program": "nordsyd",
  "project_type": "greenfield",
  "voltage_levels": {
    "existing_kv": [],
    "new_kv": [10],
    "decommissioned_kv": [],
    "voltage_note": "New 10 kV switchgear built next to existing switchgear."
  },
  "scope_description": "New 10 kV switchgear built next to existing switchgear at Brändarna. Good site availability. Part of the Bollnästriangeln cluster.",
  "equipment_scope": [
    {"equipment_type": "switchgear", "voltage_kv": 12, "count_min": null, "count_max": null, "note": "12 kV switchgear (rated voltage class 12 kV for nominal 10 kV operation)."}
  ],
  "timeline": {
    "field_work_start_year": null,
    "field_work_start_quarter": null,
    "commission_year": 2028,
    "commission_quarter": null,
    "procurement_start_date": null,
    "procurement_end_date": null,
    "construction_start_date": null,
    "construction_end_date": null,
    "timeline_note": null
  },
  "contract": {
    "value_band_msek": "over_200",
    "estimated_value_msek": null,
    "package_id": "2",
    "currency": "SEK",
    "contract_note": "Package 2 (>200 MSEK), bundled with Simessjön, Prästnäset, and Bolle."
  },
  "dependencies": {
    "svenska_kraftnat_dependency": true,
    "customer_agreement": null,
    "related_program": "NordSyd",
    "production_transfer_note": null
  },
  "lifecycle_phase": "permit_pending",
  "raw_status": "Pågående prekval",
  "narrative_note": "Brändarna is at the southern edge of the Östra Hälsingland reconfiguration; the new switchgear addition is small relative to the rest of the package.",
  "source_doc_key": "ellevio_stationsentreprenader_mellansverige_2026q1",
  "source_page": 18,
  "extraction_method": "llm_extracted",
  "extraction_run_id": "2026-05-03-stationsentreprenader-q1-2026-v1",
  "extraction_prompt_version": "v1.0",
  "confidence_tier": "observed"
}
